[
  {
    "schema_version": 1,
    "record_id": "rlp-266-public-health-v1",
    "surface_id": "surf-266-public-health",
    "window": {
      "duration_ms": 60000,
      "kind": "sliding",
      "anchor": "request_time"
    },
    "threshold": 60,
    "burst": {
      "additional_units": 10,
      "refill_units": 1,
      "refill_interval_ms": 6000
    },
    "safe_counting_key": {
      "phase": "pre_authentication",
      "components": [
        "privacy_network_cohort_v1",
        "exact_surface_id"
      ],
      "derivation_version": "hmac-sha256-v1",
      "normalization": "network-cohort-v1",
      "rotation_behavior": "dual-read/single-write for at least 120000 ms; carry forward the greater count",
      "privacy_basis": "No subject locator is used.",
      "subject_bound_after_authentication": false
    },
    "counter_store": {
      "binding": "LOCAL_PROTOTYPE_COUNTER_STORE",
      "namespace": "cbd266:prototype:public-health:v1",
      "atomic_operation": "one process-linearizable atomic consume",
      "consistency": "single-process-linearizable",
      "region": "local-process",
      "ttl_ms": 120000,
      "clock_source": "monotonic process clock",
      "failure_mode": "deny"
    },
    "quota": {
      "unit": "request",
      "ceiling": 70,
      "scope": "counting key plus exact surface",
      "reset": "sliding expiry plus burst refill",
      "resource_dimensions": []
    },
    "anti_lockout_rule": {
      "attackable_dimensions": [
        "privacy_network_cohort_v1"
      ],
      "victim_bound_dimensions": [],
      "independent_recovery_surface_id": null,
      "pool_isolation": "| `proto-public-health-v1` | `attackable_dimensions: [privacy_network_cohort_v1]`; `victim_bound_dimensions: []`; `independent_recovery_surface_id: null`; ordinary traffic cannot consume a subject pool because none exists (`FX-266-PUBLIC-COHORT-ISOLATION`); `exhaustion_state_effect: none`; reset authority is `local prototype operator / restore counter service only`; notification is one content-safe health denial with no quota remainder; the exact health route stays isolated from every protected pool; verify `FX-266-PUBLIC-COHORT-ISOLATION` and `VT-94-065`. |",
      "exhaustion_state_effect": "none",
      "reset_authority": "local prototype operator / restore counter service only",
      "notification_behavior": "one content-safe health denial with no quota remainder",
      "rationale": "| `proto-public-health-v1` | `attackable_dimensions: [privacy_network_cohort_v1]`; `victim_bound_dimensions: []`; `independent_recovery_surface_id: null`; ordinary traffic cannot consume a subject pool because none exists (`FX-266-PUBLIC-COHORT-ISOLATION`); `exhaustion_state_effect: none`; reset authority is `local prototype operator / restore counter service only`; notification is one content-safe health denial with no quota remainder; the exact health route stays isolated from every protected pool; verify `FX-266-PUBLIC-COHORT-ISOLATION` and `VT-94-065`. |",
      "verification_cases": [
        "FX-266-PUBLIC-COHORT-ISOLATION",
        "VT-94-065"
      ]
    },
    "capacity_basis": {
      "evidence_locator": "CBD266-PROTOTYPE-DEFAULTS-001 / single-local-process planning basis",
      "measured_at": "2026-09-13T00:00:00-04:00",
      "sustained_capacity": "20 requests/second in one local process; not measured - Product estimate dated 2026-09-13",
      "peak_assumption": "At most 70 requests in 60 seconds; at least 94% request-rate headroom against the estimate",
      "headroom": "At most 70 requests in 60 seconds; at least 94% request-rate headroom against the estimate",
      "failure_budget": "zero uncounted protected effects when the store is unavailable or uncertain",
      "workload_assumptions": [
        "One developer, one process, loopback/local traffic, no replicas, no hosted probes"
      ],
      "reviewer_role": "Product; ME-94-010 specialist review pending"
    },
    "source_requirements": [
      "RL-92-001",
      "RL-92-002",
      "RL-92-007",
      "EP-92-001",
      "EP-92-002",
      "EP-92-003",
      "EP-92-004",
      "EP-92-005",
      "EP-92-006",
      "EP-92-007",
      "EP-92-008",
      "EP-92-009",
      "EP-92-010",
      "EP-92-011",
      "EP-92-012",
      "EP-92-013",
      "EP-92-014",
      "EP-92-015",
      "SR-94-037",
      "ME-94-010",
      "CBD266-PROTOTYPE-DEFAULTS-001"
    ],
    "created_at": "2026-09-13T04:00:00Z",
    "supersedes_record_id": null,
    "product_owner_approval": {
      "status": "approved",
      "approval_id": "CBD266-PROTOTYPE-DEFAULTS-001",
      "approved_by_actor_id": "atlassian:5cffa74b92e6c70c53499977",
      "decided_at": "2026-09-13T00:00:00Z",
      "candidate_digest": "f614588b769507f009a31712c0f74c2e490b966f7f1d750e05cf0416381c5669",
      "conditions": [
        "prototype-only",
        "revisit before any hosted environment"
      ],
      "expires_at": null
    },
    "record_digest": "a2b7c2ffd38ad0868af428a5d149277356f54c4b31f561a960b1367c6e9a3286"
  },
  {
    "schema_version": 1,
    "record_id": "rlp-266-authenticated-read-v1",
    "surface_id": "surf-266-budget-read",
    "window": {
      "duration_ms": 60000,
      "kind": "sliding",
      "anchor": "request_time"
    },
    "threshold": 60,
    "burst": {
      "additional_units": 10,
      "refill_units": 1,
      "refill_interval_ms": 6000
    },
    "safe_counting_key": {
      "phase": "post_authentication",
      "components": [
        "verified_actor_id_v1",
        "exact_surface_id"
      ],
      "derivation_version": "hmac-sha256-v1",
      "normalization": "verified-id-v1",
      "rotation_behavior": "dual-read/single-write for at least 120000 ms; carry forward the greater count",
      "privacy_basis": "Actor from verified server context only; correlation limited to actor plus exact surface; no shared space dimension.",
      "subject_bound_after_authentication": true
    },
    "counter_store": {
      "binding": "LOCAL_PROTOTYPE_COUNTER_STORE",
      "namespace": "cbd266:prototype:authenticated-read:v1",
      "atomic_operation": "one process-linearizable atomic consume",
      "consistency": "single-process-linearizable",
      "region": "local-process",
      "ttl_ms": 120000,
      "clock_source": "monotonic process clock",
      "failure_mode": "deny"
    },
    "quota": {
      "unit": "request",
      "ceiling": 70,
      "scope": "verified actor plus exact surface",
      "reset": "sliding expiry plus burst refill",
      "resource_dimensions": []
    },
    "anti_lockout_rule": {
      "attackable_dimensions": [],
      "victim_bound_dimensions": [
        "verified_actor_id_v1"
      ],
      "independent_recovery_surface_id": "surf-266-recovery",
      "pool_isolation": "| `proto-authenticated-read-v1` | `attackable_dimensions: []`; `victim_bound_dimensions: [verified_actor_id_v1]`; `independent_recovery_surface_id: surf-266-recovery`; unauthenticated and other authenticated actors cannot consume the verified actor's pool, and recovery has a separate namespace/key (`FX-266-LOCKOUT-RECOVERY`); `exhaustion_state_effect: none`; reset authority is `local prototype operator / restore counter service only`; notification is uniform and reveals neither existence nor remaining quota; verify `FX-266-AUTHENTICATED-ACTOR-ISOLATION`, `FX-266-LOCKOUT-RECOVERY`, and `VT-94-066`. |",
      "exhaustion_state_effect": "none",
      "reset_authority": "local prototype operator / restore counter service only",
      "notification_behavior": "uniform, content-safe; neither existence nor remaining quota",
      "rationale": "| `proto-authenticated-read-v1` | `attackable_dimensions: []`; `victim_bound_dimensions: [verified_actor_id_v1]`; `independent_recovery_surface_id: surf-266-recovery`; unauthenticated and other authenticated actors cannot consume the verified actor's pool, and recovery has a separate namespace/key (`FX-266-LOCKOUT-RECOVERY`); `exhaustion_state_effect: none`; reset authority is `local prototype operator / restore counter service only`; notification is uniform and reveals neither existence nor remaining quota; verify `FX-266-AUTHENTICATED-ACTOR-ISOLATION`, `FX-266-LOCKOUT-RECOVERY`, and `VT-94-066`. |",
      "verification_cases": [
        "FX-266-AUTHENTICATED-ACTOR-ISOLATION",
        "FX-266-LOCKOUT-RECOVERY",
        "VT-94-066"
      ]
    },
    "capacity_basis": {
      "evidence_locator": "CBD266-PROTOTYPE-DEFAULTS-001 / single-local-process planning basis",
      "measured_at": "2026-09-13T00:00:00-04:00",
      "sustained_capacity": "10 requests/second in one local process; not measured - Product estimate dated 2026-09-13",
      "peak_assumption": "At most 70 requests in 60 seconds; at least 88% request-rate headroom against the estimate",
      "headroom": "At most 70 requests in 60 seconds; at least 88% request-rate headroom against the estimate",
      "failure_budget": "zero uncounted protected effects when the store is unavailable or uncertain",
      "workload_assumptions": [
        "One developer, one process, local data, no background consumers, no hosted traffic"
      ],
      "reviewer_role": "Product; ME-94-010 specialist review pending"
    },
    "source_requirements": [
      "RL-92-001",
      "RL-92-002",
      "RL-92-007",
      "EP-92-003",
      "SR-94-037",
      "ME-94-010",
      "CBD266-PROTOTYPE-DEFAULTS-001"
    ],
    "created_at": "2026-09-13T04:00:00Z",
    "supersedes_record_id": null,
    "product_owner_approval": {
      "status": "approved",
      "approval_id": "CBD266-PROTOTYPE-DEFAULTS-001",
      "approved_by_actor_id": "atlassian:5cffa74b92e6c70c53499977",
      "decided_at": "2026-09-13T00:00:00Z",
      "candidate_digest": "19562bd15bc72a98ec25edd8c16b27da369f0c4f07c19b7d852acb720416c73b",
      "conditions": [
        "prototype-only",
        "revisit before any hosted environment"
      ],
      "expires_at": null
    },